{
    "id": "019f8f83-cfbb-765a-8182-e4716c8e8f2b",
    "version": 1,
    "title": "Kachumbari",
    "overview": {
        "description": "A fresh East African salad of tomatoes, red onion, coriander, lime and chilli, served with avocado and beans for a more substantial meal.",
        "country": "Kenya",
        "region": "East Africa",
        "serves": 4
    },
    "ingredients": [
        "600g ripe tomatoes, diced",
        "1 large red onion, finely diced",
        "1 large avocado, diced",
        "1 x 400g tin black beans or kidney beans, drained and rinsed",
        "1 large handful fresh coriander, chopped",
        "1–2 green chillies, finely sliced, optional",
        "Juice of 2 limes",
        "1 tbsp extra virgin olive oil",
        "½ tsp salt, or to taste",
        "Black pepper, to taste"
    ],
    "method": [
        "Place the diced red onion in a bowl.",
        "Cover with cold water and leave for 10 minutes.",
        "Drain thoroughly.",
        "Add the tomatoes, avocado, beans, coriander and chilli if using.",
        "Add the lime juice, olive oil, salt and black pepper.",
        "Toss gently to combine.",
        "Taste and adjust the lime juice and seasoning.",
        "Serve immediately."
    ],
    "serving": {
        "serve-with": [
            "Chapati",
            "Ugali",
            "Crusty Bread"
        ],
        "optional-sides": [
            "Grilled Chicken",
            "Grilled Meat",
            "Pilau Rice",
            "Plain Yogurt"
        ]
    },
    "planner": {
        "prep-time-minutes": 15,
        "cook-time-minutes": 0,
        "freezer-label": "better fresh",
        "cost": "low",
        "after-work": true
    },
    "learning": {
        "did-you-know": "The name kachumbari is related to the Swahili word for a salad of chopped fresh ingredients. It is particularly popular across East Africa and is commonly served with grilled meats and rice dishes.",
        "what-you-will-learn": "How a simple combination of fresh ingredients can be balanced through acidity, salt and heat, and how to turn a traditional accompaniment into a more substantial meal.",
        "skills": [
            "Preparing raw vegetables",
            "Balancing acidity",
            "Handling chillies",
            "Preparing avocado",
            "Building a fresh salad"
        ]
    },
    "notes": {
        "why-its-in-the-chapman-kitchen": "A quick, inexpensive and highly adaptable salad that introduces East African flavours and can work either as a complete bean-based meal or as a fresh accompaniment to grilled foods.",
        "chapman-tips": [
            "Soaking the diced onion briefly in cold water softens its sharpness.",
            "Use ripe, flavourful tomatoes.",
            "Add the avocado shortly before serving so it remains intact.",
            "The lime should provide a noticeable sharpness.",
            "Chilli is optional and can be added only to adult portions.",
            "For the most traditional accompaniment, serve the core tomato and onion salad alongside grilled meat.",
            "Beans make the salad much more substantial as a complete meal.",
            "Chapati is an excellent accompaniment and makes the meal more filling."
        ],
        "batch-cooking": "Better fresh. The tomatoes release liquid and the avocado softens over time.",
        "leftovers": "Best eaten the same day. Leftovers can be used in wraps or served with rice and beans."
    },
    "relationships": {
        "similar-recipes": [
            "Kachumber",
            "Shirazi Salad",
            "Greek Salad",
            "Som Tam",
            "Vietnamese Chicken Salad"
        ]
    },
    "history": [
        {
            "date": "",
            "note": ""
        }
    ],
    "metadata": {
        "created": "2026-07-23",
        "updated": "",
        "created-by": "Daddy",
        "updated-by": ""
    }
}
