{
    "id": "019f8e14-070b-725d-ac5a-6da236f7c925",
    "version": 1,
    "title": "Mie Goreng Jawa",
    "overview": {
        "description": "A Javanese-style fried noodle dish made with egg noodles, chicken, cabbage, tomato and a fragrant garlic and shallot spice paste.",
        "country": "Indonesia",
        "region": "Java",
        "serves": 4
    },
    "ingredients": [
        "400g fresh or dried egg noodles",
        "300g boneless chicken thighs, thinly sliced",
        "2 tbsp neutral oil",
        "150g white cabbage, finely shredded",
        "1 large tomato, cut into wedges",
        "2 spring onions, sliced",
        "2 eggs",
        "1 tbsp kecap manis",
        "1 tbsp light soy sauce",
        "1 tsp white pepper",
        "100ml water or chicken stock",
        "Fried shallots, to serve",
        "",
        "For the bumbu:",
        "4 shallots, roughly chopped",
        "4 garlic cloves",
        "2 candlenuts, optional",
        "1 tsp ground coriander",
        "½ tsp ground cumin",
        "1–2 red chillies, optional",
        "½ tsp salt"
    ],
    "method": [
        "Prepare the egg noodles according to the packet instructions, taking care not to overcook them.",
        "Drain thoroughly and set aside.",
        "Add the shallots, garlic, candlenuts if using, ground coriander, ground cumin, chillies if using and salt to a mortar or blender.",
        "Grind or blend to a coarse paste.",
        "Heat the oil in a wok or large frying pan over medium-high heat.",
        "Add the bumbu paste.",
        "Cook until fragrant and the shallots and garlic have softened.",
        "Add the chicken and stir-fry until almost cooked through.",
        "Push the ingredients to one side of the wok.",
        "Crack in the eggs and scramble until just set.",
        "Add the cabbage and stir-fry for 1–2 minutes.",
        "Add the noodles, kecap manis, light soy sauce and white pepper.",
        "Add the water or chicken stock.",
        "Toss everything together until the noodles are hot and evenly coated.",
        "Add the tomato and spring onions.",
        "Stir-fry briefly until the tomato is warmed and beginning to soften.",
        "Taste and adjust the seasoning.",
        "Serve topped with fried shallots."
    ],
    "serving": {
        "serve-with": [
            "Fried Shallots"
        ],
        "optional-sides": [
            "Cucumber",
            "Pickled Vegetables",
            "Sambal",
            "Lime Wedges"
        ]
    },
    "planner": {
        "prep-time-minutes": 20,
        "cook-time-minutes": 15,
        "freezer-label": "better fresh",
        "cost": "moderate",
        "after-work": true
    },
    "learning": {
        "did-you-know": "Bakmi goreng Jawa is associated particularly with Java and is often cooked to order by street vendors. Javanese versions are generally more aromatic and sweet-savoury than the fiery Malaysian mee goreng.",
        "what-you-will-learn": "How a spice paste forms the flavour foundation of a dish and how Javanese cooking balances savoury, aromatic and sweet flavours.",
        "skills": [
            "Making a spice paste",
            "Stir-frying",
            "Cooking egg noodles",
            "Balancing sweet and savoury flavours",
            "Managing high-heat cooking"
        ]
    },
    "notes": {
        "why-its-in-the-chapman-kitchen": "A regional Indonesian noodle dish that gives egg noodles a completely different character from both chow mein and Malaysian mee goreng.",
        "chapman-tips": [
            "The bumbu is the heart of the dish, so cook it long enough for the raw garlic and shallot flavour to disappear.",
            "Candlenuts add richness and body but are optional and can be difficult to find.",
            "Keep the chilli moderate in the main dish and serve sambal separately if you want more heat.",
            "Don't overcook the noodles before stir-frying.",
            "The small amount of stock or water helps the noodles absorb the flavour of the bumbu.",
            "Add the tomato near the end so it retains some texture.",
            "Fried shallots are highly recommended; they add sweetness, crunch and a distinctive Indonesian flavour."
        ],
        "batch-cooking": "Best eaten fresh. The noodles and vegetables lose texture when frozen and reheated.",
        "leftovers": "Reheat quickly in a hot frying pan or wok. Leftovers make a good packed lunch when reheated thoroughly."
    },
    "relationships": {
        "similar-recipes": [
            "Mee Goreng",
            "Chow Mein",
            "Pad Kee Mao",
            "Chicken Fajitas"
        ]
    },
    "history": [
        {
            "date": "",
            "note": ""
        }
    ],
    "metadata": {
        "created": "2026-07-23",
        "updated": "",
        "created-by": "Daddy",
        "updated-by": ""
    }
}
